{"candidate_manifest_sha256":"94466c0f1efed64b6e0c5e8ea8e6b3ed5a4537c4a5e44576a2d081b9f409f501","cell_dispositions":[{"cell_id":"s001!A1","disposition":"not_applicable","owner_id":null,"rationale":"Header label"},{"cell_id":"s001!B1","disposition":"not_applicable","owner_id":null,"rationale":"Header label"},{"cell_id":"s001!C1","disposition":"not_applicable","owner_id":null,"rationale":"Header label"},{"cell_id":"s001!D1","disposition":"not_applicable","owner_id":null,"rationale":"Header label"},{"cell_id":"s001!E1","disposition":"not_applicable","owner_id":null,"rationale":"Header label"},{"cell_id":"s001!F1","disposition":"not_applicable","owner_id":null,"rationale":"Header label"},{"cell_id":"s001!G1","disposition":"not_applicable","owner_id":null,"rationale":"Header label"},{"cell_id":"s001!H1","disposition":"not_applicable","owner_id":null,"rationale":"Header label"},{"cell_id":"s001!I1","disposition":"not_applicable","owner_id":null,"rationale":"Header label"},{"cell_id":"s001!J1","disposition":"not_applicable","owner_id":null,"rationale":"Header label"},{"cell_id":"s001!K1","disposition":"not_applicable","owner_id":null,"rationale":"Header label"},{"cell_id":"s001!L1","disposition":"not_applicable","owner_id":null,"rationale":"Header label"},{"cell_id":"s001!M1","disposition":"not_applicable","owner_id":null,"rationale":"Header label"},{"cell_id":"s001!N1","disposition":"not_applicable","owner_id":null,"rationale":"Header label"},{"cell_id":"s001!O1","disposition":"not_applicable","owner_id":null,"rationale":"Header label"},{"cell_id":"s001!P1","disposition":"not_applicable","owner_id":null,"rationale":"Header label"},{"cell_id":"s001!Q1","disposition":"not_applicable","owner_id":null,"rationale":"Header label"},{"cell_id":"s001!R1","disposition":"not_applicable","owner_id":null,"rationale":"Header label"},{"cell_id":"s001!S1","disposition":"not_applicable","owner_id":null,"rationale":"Header label"},{"cell_id":"s001!T1","disposition":"not_applicable","owner_id":null,"rationale":"Header label"},{"cell_id":"s001!U1","disposition":"not_applicable","owner_id":null,"rationale":"Header label"},{"cell_id":"s001!V1","disposition":"not_applicable","owner_id":null,"rationale":"Header label"},{"cell_id":"s001!W1","disposition":"not_applicable","owner_id":null,"rationale":"Header label"},{"cell_id":"s001!X1","disposition":"not_applicable","owner_id":null,"rationale":"Header label"},{"cell_id":"s001!Y1","disposition":"not_applicable","owner_id":null,"rationale":"Header label"},{"cell_id":"s001!Z1","disposition":"not_applicable","owner_id":null,"rationale":"Header label"},{"cell_id":"s001!AA1","disposition":"not_applicable","owner_id":null,"rationale":"Header label"},{"cell_id":"s001!AB1","disposition":"not_applicable","owner_id":null,"rationale":"Header label"},{"cell_id":"s001!A2","disposition":"model_input","owner_id":"cp","rationale":"Instrument model evidence"},{"cell_id":"s001!B2","disposition":"model_input","owner_id":"cp","rationale":"Instrument model evidence"},{"cell_id":"s001!C2","disposition":"model_input","owner_id":"cp","rationale":"Instrument model evidence"},{"cell_id":"s001!D2","disposition":"model_input","owner_id":"cp","rationale":"Instrument model evidence"},{"cell_id":"s001!E2","disposition":"model_input","owner_id":"cp","rationale":"Instrument model evidence"},{"cell_id":"s001!P2","disposition":"model_input","owner_id":"cp","rationale":"Instrument model evidence"},{"cell_id":"s001!S2","disposition":"model_input","owner_id":"cp","rationale":"Instrument model evidence"},{"cell_id":"s001!T2","disposition":"model_input","owner_id":"cp","rationale":"Instrument model evidence"},{"cell_id":"s001!U2","disposition":"model_input","owner_id":"cp","rationale":"Instrument model evidence"},{"cell_id":"s001!V2","disposition":"model_input","owner_id":"cp","rationale":"Instrument model evidence"},{"cell_id":"s001!Y2","disposition":"supplemental_evidence","owner_id":"cp","rationale":"Audit-only debt evidence"},{"cell_id":"s001!Z2","disposition":"supplemental_evidence","owner_id":"cp","rationale":"Audit-only debt evidence"},{"cell_id":"s001!AA2","disposition":"supplemental_evidence","owner_id":"cp","rationale":"Audit-only debt evidence"},{"cell_id":"s001!AB2","disposition":"supplemental_evidence","owner_id":"cp","rationale":"Audit-only debt evidence"},{"cell_id":"s001!A3","disposition":"model_input","owner_id":"rcf","rationale":"Instrument model evidence"},{"cell_id":"s001!B3","disposition":"model_input","owner_id":"rcf","rationale":"Instrument model evidence"},{"cell_id":"s001!C3","disposition":"model_input","owner_id":"rcf","rationale":"Instrument model evidence"},{"cell_id":"s001!D3","disposition":"model_input","owner_id":"rcf","rationale":"Instrument model evidence"},{"cell_id":"s001!E3","disposition":"model_input","owner_id":"rcf","rationale":"Instrument model evidence"},{"cell_id":"s001!F3","disposition":"model_input","owner_id":"rcf","rationale":"Instrument model evidence"},{"cell_id":"s001!H3","disposition":"model_input","owner_id":"rcf","rationale":"Instrument model evidence"},{"cell_id":"s001!I3","disposition":"model_input","owner_id":"rcf","rationale":"Instrument model evidence"},{"cell_id":"s001!K3","disposition":"model_input","owner_id":"rcf","rationale":"Instrument model evidence"},{"cell_id":"s001!L3","disposition":"model_input","owner_id":"rcf","rationale":"Instrument model evidence"},{"cell_id":"s001!M3","disposition":"model_input","owner_id":"rcf","rationale":"Instrument model evidence"},{"cell_id":"s001!P3","disposition":"model_input","owner_id":"rcf","rationale":"Instrument model evidence"},{"cell_id":"s001!Q3","disposition":"model_input","owner_id":"rcf","rationale":"Instrument model evidence"},{"cell_id":"s001!R3","disposition":"model_input","owner_id":"rcf","rationale":"Instrument model evidence"},{"cell_id":"s001!S3","disposition":"model_input","owner_id":"rcf","rationale":"Instrument model evidence"},{"cell_id":"s001!T3","disposition":"model_input","owner_id":"rcf","rationale":"Instrument model evidence"},{"cell_id":"s001!U3","disposition":"model_input","owner_id":"rcf","rationale":"Instrument model evidence"},{"cell_id":"s001!V3","disposition":"model_input","owner_id":"rcf","rationale":"Instrument model evidence"},{"cell_id":"s001!X3","disposition":"model_input","owner_id":"rcf","rationale":"Instrument model evidence"},{"cell_id":"s001!Y3","disposition":"supplemental_evidence","owner_id":"rcf","rationale":"Audit-only debt evidence"},{"cell_id":"s001!Z3","disposition":"supplemental_evidence","owner_id":"rcf","rationale":"Audit-only debt evidence"},{"cell_id":"s001!AA3","disposition":"supplemental_evidence","owner_id":"rcf","rationale":"Audit-only debt evidence"},{"cell_id":"s001!AB3","disposition":"supplemental_evidence","owner_id":"rcf","rationale":"Audit-only debt evidence"},{"cell_id":"s001!A4","disposition":"model_input","owner_id":"bond","rationale":"Instrument model evidence"},{"cell_id":"s001!B4","disposition":"model_input","owner_id":"bond","rationale":"Instrument model evidence"},{"cell_id":"s001!C4","disposition":"model_input","owner_id":"bond","rationale":"Instrument model evidence"},{"cell_id":"s001!E4","disposition":"model_input","owner_id":"bond","rationale":"Instrument model evidence"},{"cell_id":"s001!F4","disposition":"model_input","owner_id":"bond","rationale":"Instrument model evidence"},{"cell_id":"s001!G4","disposition":"model_input","owner_id":"bond","rationale":"Instrument model evidence"},{"cell_id":"s001!N4","disposition":"model_input","owner_id":"bond","rationale":"Instrument model evidence"},{"cell_id":"s001!O4","disposition":"model_input","owner_id":"bond","rationale":"Instrument model evidence"},{"cell_id":"s001!P4","disposition":"model_input","owner_id":"bond","rationale":"Instrument model evidence"},{"cell_id":"s001!S4","disposition":"model_input","owner_id":"bond","rationale":"Instrument model evidence"},{"cell_id":"s001!T4","disposition":"model_input","owner_id":"bond","rationale":"Instrument model evidence"},{"cell_id":"s001!U4","disposition":"model_input","owner_id":"bond","rationale":"Instrument model evidence"},{"cell_id":"s001!V4","disposition":"model_input","owner_id":"bond","rationale":"Instrument model evidence"},{"cell_id":"s001!W4","disposition":"model_input","owner_id":"bond","rationale":"Instrument model evidence"},{"cell_id":"s001!Y4","disposition":"supplemental_evidence","owner_id":"bond","rationale":"Audit-only debt evidence"},{"cell_id":"s001!Z4","disposition":"supplemental_evidence","owner_id":"bond","rationale":"Audit-only debt evidence"},{"cell_id":"s001!AA4","disposition":"supplemental_evidence","owner_id":"bond","rationale":"Audit-only debt evidence"},{"cell_id":"s001!AB4","disposition":"supplemental_evidence","owner_id":"bond","rationale":"Audit-only debt evidence"}],"export_metadata":{"as_of":"2025-12-31","columns":[{"currency":"USD","field":"outstanding_amount","units":"millions"},{"currency":"USD","field":"facility_limit","units":"millions"},{"currency":"USD","field":"drawn_amount","units":"millions"}],"entity":{"name":"Controlled Issuer"},"reporting_currency":"USD","source":{"date_basis":"last_fiscal_year_end","system":"Controlled DCS fixture"},"units":"millions"},"instruments":[{"candidate_id":"cp-row","disposition":"model_input","instrument_id":"cp","pricing_treatment":"residual_interest_plug","pricing_treatment_reason":"Source contains no programme pricing; preserve exposure and use the visible residual-interest bridge.","rationale":"Zero drawn commercial paper remains a valid instrument","row_ids":["s001!row:2"],"term_authorities":[{"authority_kind":"source_cell","model_field":"description","output_value":"Commercial Paper","precision":"exact","source_cells":["s001!A2"],"transform":{"kind":"direct"}},{"authority_kind":"source_cell","model_field":"instrument_type","output_value":"commercial_paper","precision":"exact","source_cells":["s001!B2"],"transform":{"kind":"direct"}},{"authority_kind":"source_cell","model_field":"curren